{
  "schema_version": "v1",
  "response_type": "ingestion_job",
  "tenant_id": "11111111-1111-4111-8111-111111111111",
  "request_id": "55555555-5555-4555-8555-555555555555",
  "audit_id": "77777777-7777-4777-8777-777777777777",
  "result": "new",
  "job": {
    "job_id": "88888888-8888-4888-8888-888888888888",
    "document_version_id": "aaaaaaaa-0000-4000-8000-000000000106",
    "pipeline_profile": "municipal_document_v1",
    "status": "queued",
    "attempt_count": 0,
    "max_attempts": 3,
    "available_at": "2026-07-19T21:00:00.000Z",
    "started_at": null,
    "finished_at": null,
    "lease_expires_at": null,
    "heartbeat_at": null,
    "last_error_code": null,
    "last_error_retryable": null,
    "created_at": "2026-07-19T21:00:00.000Z",
    "updated_at": "2026-07-19T21:00:00.000Z"
  },
  "provenance": {
    "source_product": "la_muni_rag",
    "generated_by": "system",
    "created_at": "2026-07-19T21:00:00.000Z",
    "source_refs": [
      "aaaaaaaa-0000-4000-8000-000000000106",
      "88888888-8888-4888-8888-888888888888"
    ],
    "credential_id": "44444444-4444-4444-8444-444444444444",
    "audit_id": "77777777-7777-4777-8777-777777777777"
  }
}
